"path","url","status","final_url","content_type","title","meta_description","canonical","robots","h1","h1_count","schema_types","schema_errors","internal_links","content_length","old_copy_hits","placeholder_phone","tel_links","label_count","form_control_count","aria_live"
"/","https://plumbinghands.com/","200","https://plumbinghands.com/","text/html; charset=utf-8","Emergency plumbing help across Dallas-Fort Worth","Request urgent plumbing help across Dallas-Fort Worth for drain, sewer, pipe, toilet, and water-heater problems.","https://plumbinghands.com","index/follow default","Emergency Plumbing Help Across Dallas-Fort Worth","1","BreadcrumbList|FAQPage|Organization|WebPage","0","78","6190","","no","","6","12","no"
"/cities","https://plumbinghands.com/cities","200","https://plumbinghands.com/cities","text/html; charset=utf-8","Dallas-Fort Worth plumbing service areas | Plumbing Hands","Browse Dallas-Fort Worth service-area pages for emergency plumbing, drain, sewer, leak, toilet, and water-heater help.","https://plumbinghands.com/cities","index/follow default","Emergency plumbing help by DFW location","1","BreadcrumbList|Organization|WebPage","0","66","5355","","no","","0","0","no"
"/blog","https://plumbinghands.com/blog","200","https://plumbinghands.com/blog","text/html; charset=utf-8","Emergency plumbing guides | Plumbing Hands","Practical emergency plumbing, drain, sewer, cost, and decision guides for Dallas-Fort Worth homeowners.","https://plumbinghands.com/blog","index/follow default","Emergency plumbing guides","1","BreadcrumbList|FAQPage|Organization|WebPage","0","75","10527","","no","","0","0","no"
"/faq","https://plumbinghands.com/faq","200","https://plumbinghands.com/faq","text/html; charset=utf-8","Emergency plumbing and drain cleaning FAQ | Plumbing Hands","Answer-ready FAQ hub for urgent plumbing, drain, sewer, cost, and provider connection questions.","https://plumbinghands.com/faq","index/follow default","Emergency plumbing and drain cleaning FAQ","1","BreadcrumbList|FAQPage|Organization|WebPage","0","41","4060","","no","","0","0","no"
"/contact","https://plumbinghands.com/contact","200","https://plumbinghands.com/contact","text/html; charset=utf-8","Request urgent plumbing help | Plumbing Hands","Contact page for Dallas-Fort Worth emergency plumbing and drain cleaning service requests.","https://plumbinghands.com/contact","index/follow default","Request urgent plumbing help","1","BreadcrumbList|Organization|WebPage","0","33","1888","","no","","6","12","no"
"/partner-with-us","https://plumbinghands.com/partner-with-us","200","https://plumbinghands.com/partner-with-us","text/html; charset=utf-8","Provider partner inquiries | Plumbing Hands","Partner inquiry page for plumbing providers and service partners in Dallas-Fort Worth.","https://plumbinghands.com/partner-with-us","index/follow default","Provider partner inquiries","1","BreadcrumbList|Organization|WebPage","0","32","2117","","no","","15","22","no"
"/privacy","https://plumbinghands.com/privacy","200","https://plumbinghands.com/privacy","text/html; charset=utf-8","Privacy policy | Plumbing Hands","Privacy policy for the Dallas-Fort Worth emergency plumbing service request website.","https://plumbinghands.com/privacy","index/follow default","Privacy policy","1","BreadcrumbList|Organization|WebPage","0","32","1136","","no","","0","0","no"
"/terms","https://plumbinghands.com/terms","200","https://plumbinghands.com/terms","text/html; charset=utf-8","Terms of use | Plumbing Hands","Terms of use for the Dallas-Fort Worth emergency plumbing service request website.","https://plumbinghands.com/terms","index/follow default","Terms of use","1","BreadcrumbList|Organization|WebPage","0","32","1172","","no","","0","0","no"
"/disclosure","https://plumbinghands.com/disclosure","200","https://plumbinghands.com/disclosure","text/html; charset=utf-8","Provider connection disclosure | Plumbing Hands","Disclosure for the Dallas-Fort Worth emergency plumbing service request website.","https://plumbinghands.com/disclosure","index/follow default","Provider connection disclosure","1","BreadcrumbList|Organization|WebPage","0","32","1399","","no","","0","0","no"
"/services/24-hour-emergency-plumber","https://plumbinghands.com/services/24-hour-emergency-plumber","200","https://plumbinghands.com/services/24-hour-emergency-plumber","text/html; charset=utf-8","24-hour emergency plumber in Dallas-Fort Worth | Plumbing Hands","If water is actively leaking, a drain is backing up, or an essential fixture cannot be used safely, shut off the closest valve when possible and request urgent plumbing help.","https://plumbinghands.com/services/24-hour-emergency-plumber","index/follow default","24-hour emergency plumber in Dallas-Fort Worth","1","BreadcrumbList|FAQPage|Organization|Service|WebPage","0","44","7758","","no","","6","12","no"
"/services/emergency-drain-cleaning","https://plumbinghands.com/services/emergency-drain-cleaning","200","https://plumbinghands.com/services/emergency-drain-cleaning","text/html; charset=utf-8","emergency drain cleaning in Dallas-Fort Worth | Plumbing Hands","Emergency drain cleaning is needed when wastewater is backing up, more than one fixture is affected, or a clog blocks a kitchen, bathroom, or business from operating.","https://plumbinghands.com/services/emergency-drain-cleaning","index/follow default","emergency drain cleaning in Dallas-Fort Worth","1","BreadcrumbList|FAQPage|Organization|Service|WebPage","0","44","7662","","no","","6","12","no"
"/services/main-sewer-line-clog","https://plumbinghands.com/services/main-sewer-line-clog","200","https://plumbinghands.com/services/main-sewer-line-clog","text/html; charset=utf-8","main sewer line clog in Dallas-Fort Worth | Plumbing Hands","A main sewer line clog often affects several fixtures at once. Stop using water, avoid flushing toilets, and request urgent sewer line guidance.","https://plumbinghands.com/services/main-sewer-line-clog","index/follow default","main sewer line clog in Dallas-Fort Worth","1","BreadcrumbList|FAQPage|Organization|Service|WebPage","0","44","7485","","no","","6","12","no"
"/services/toilet-overflow-emergency","https://plumbinghands.com/services/toilet-overflow-emergency","200","https://plumbinghands.com/services/toilet-overflow-emergency","text/html; charset=utf-8","toilet overflow emergency in Dallas-Fort Worth | Plumbing Hands","For an overflowing toilet, turn the toilet supply valve clockwise, avoid repeated flushing, and call if water keeps rising or other drains are backing up.","https://plumbinghands.com/services/toilet-overflow-emergency","index/follow default","toilet overflow emergency in Dallas-Fort Worth","1","BreadcrumbList|FAQPage|Organization|Service|WebPage","0","44","5839","","no","","6","12","no"
"/services/burst-pipe-emergency","https://plumbinghands.com/services/burst-pipe-emergency","200","https://plumbinghands.com/services/burst-pipe-emergency","text/html; charset=utf-8","burst pipe emergency in Dallas-Fort Worth | Plumbing Hands","For a burst pipe, shut off the main water valve, protect electrical areas, and request emergency plumbing help as soon as possible.","https://plumbinghands.com/services/burst-pipe-emergency","index/follow default","burst pipe emergency in Dallas-Fort Worth","1","BreadcrumbList|FAQPage|Organization|Service|WebPage","0","44","7324","","no","","6","12","no"
"/services/water-heater-emergency","https://plumbinghands.com/services/water-heater-emergency","200","https://plumbinghands.com/services/water-heater-emergency","text/html; charset=utf-8","water heater emergency in Dallas-Fort Worth | Plumbing Hands","A leaking or unsafe water heater needs fast attention. Shut off water and power or gas if safe, then request help for inspection or repair.","https://plumbinghands.com/services/water-heater-emergency","index/follow default","water heater emergency in Dallas-Fort Worth","1","BreadcrumbList|FAQPage|Organization|Service|WebPage","0","44","5753","","no","","6","12","no"
"/services/sewer-backup-help","https://plumbinghands.com/services/sewer-backup-help","200","https://plumbinghands.com/services/sewer-backup-help","text/html; charset=utf-8","sewer backup help in Dallas-Fort Worth | Plumbing Hands","A sewer backup can expose people to contaminated water. Stop using plumbing fixtures, keep the area clear, and request urgent guidance.","https://plumbinghands.com/services/sewer-backup-help","index/follow default","sewer backup help in Dallas-Fort Worth","1","BreadcrumbList|FAQPage|Organization|Service|WebPage","0","44","5646","","no","","6","12","no"
"/services/commercial-emergency-plumbing","https://plumbinghands.com/services/commercial-emergency-plumbing","200","https://plumbinghands.com/services/commercial-emergency-plumbing","text/html; charset=utf-8","commercial emergency plumbing in Dallas-Fort Worth | Plumbing Hands","Businesses should call quickly when plumbing stops operations, affects customers, or risks property damage.","https://plumbinghands.com/services/commercial-emergency-plumbing","index/follow default","commercial emergency plumbing in Dallas-Fort Worth","1","BreadcrumbList|FAQPage|Organization|Service|WebPage","0","44","5723","","no","","6","12","no"
"/services/same-day-plumber-connection","https://plumbinghands.com/services/same-day-plumber-connection","200","https://plumbinghands.com/services/same-day-plumber-connection","text/html; charset=utf-8","same-day plumber connection in Dallas-Fort Worth | Plumbing Hands","A same-day plumber connection helps route urgent non-life-safety plumbing needs to available local providers.","https://plumbinghands.com/services/same-day-plumber-connection","index/follow default","same-day plumber connection in Dallas-Fort Worth","1","BreadcrumbList|FAQPage|Organization|Service|WebPage","0","44","5575","","no","","6","12","no"
"/services/sink-and-shower-drain-backup","https://plumbinghands.com/services/sink-and-shower-drain-backup","200","https://plumbinghands.com/services/sink-and-shower-drain-backup","text/html; charset=utf-8","sink and shower drain backup in Dallas-Fort Worth | Plumbing Hands","When a sink and shower back up together, the problem may be deeper than one fixture. Stop water use and request drain guidance.","https://plumbinghands.com/services/sink-and-shower-drain-backup","index/follow default","sink and shower drain backup in Dallas-Fort Worth","1","BreadcrumbList|FAQPage|Organization|Service|WebPage","0","44","5700","","no","","6","12","no"
"/cities/dallas","https://plumbinghands.com/cities/dallas","200","https://plumbinghands.com/cities/dallas","text/html; charset=utf-8","Emergency plumbing help in Dallas, TX | Plumbing Hands","Request emergency plumbing and drain cleaning help serving Dallas, TX with clear service-area guidance.","https://plumbinghands.com/cities/dallas","index/follow default","Emergency plumbing help in Dallas","1","BreadcrumbList|FAQPage|Organization|WebPage","0","60","6296","","no","","6","12","no"
"/cities/fort-worth","https://plumbinghands.com/cities/fort-worth","200","https://plumbinghands.com/cities/fort-worth","text/html; charset=utf-8","Emergency plumbing help in Fort Worth, TX | Plumbing Hands","Request emergency plumbing and drain cleaning help serving Fort Worth, TX with clear service-area guidance.","https://plumbinghands.com/cities/fort-worth","index/follow default","Emergency plumbing help in Fort Worth","1","BreadcrumbList|FAQPage|Organization|WebPage","0","60","4948","","no","","6","12","no"
"/cities/arlington","https://plumbinghands.com/cities/arlington","200","https://plumbinghands.com/cities/arlington","text/html; charset=utf-8","Emergency plumbing help in Arlington, TX | Plumbing Hands","Request emergency plumbing and drain cleaning help serving Arlington, TX with clear service-area guidance.","https://plumbinghands.com/cities/arlington","index/follow default","Emergency plumbing help in Arlington","1","BreadcrumbList|FAQPage|Organization|WebPage","0","60","4915","","no","","6","12","no"
"/cities/plano","https://plumbinghands.com/cities/plano","200","https://plumbinghands.com/cities/plano","text/html; charset=utf-8","Emergency plumbing help in Plano, TX | Plumbing Hands","Request emergency plumbing and drain cleaning help serving Plano, TX with clear service-area guidance.","https://plumbinghands.com/cities/plano","index/follow default","Emergency plumbing help in Plano","1","BreadcrumbList|FAQPage|Organization|WebPage","0","60","4860","","no","","6","12","no"
"/cities/irving","https://plumbinghands.com/cities/irving","200","https://plumbinghands.com/cities/irving","text/html; charset=utf-8","Emergency plumbing help in Irving, TX | Plumbing Hands","Request emergency plumbing and drain cleaning help serving Irving, TX with clear service-area guidance.","https://plumbinghands.com/cities/irving","index/follow default","Emergency plumbing help in Irving","1","BreadcrumbList|FAQPage|Organization|WebPage","0","60","4870","","no","","6","12","no"
"/cities/garland","https://plumbinghands.com/cities/garland","200","https://plumbinghands.com/cities/garland","text/html; charset=utf-8","Emergency plumbing help in Garland, TX | Plumbing Hands","Request emergency plumbing and drain cleaning help serving Garland, TX with clear service-area guidance.","https://plumbinghands.com/cities/garland","index/follow default","Emergency plumbing help in Garland","1","BreadcrumbList|FAQPage|Organization|WebPage","0","60","4884","","no","","6","12","no"
"/cities/frisco","https://plumbinghands.com/cities/frisco","200","https://plumbinghands.com/cities/frisco","text/html; charset=utf-8","Emergency plumbing help in Frisco, TX | Plumbing Hands","Request emergency plumbing and drain cleaning help serving Frisco, TX with clear service-area guidance.","https://plumbinghands.com/cities/frisco","index/follow default","Emergency plumbing help in Frisco","1","BreadcrumbList|FAQPage|Organization|WebPage","0","60","4889","","no","","6","12","no"
"/cities/mckinney","https://plumbinghands.com/cities/mckinney","200","https://plumbinghands.com/cities/mckinney","text/html; charset=utf-8","Emergency plumbing help in McKinney, TX | Plumbing Hands","Request emergency plumbing and drain cleaning help serving McKinney, TX with clear service-area guidance.","https://plumbinghands.com/cities/mckinney","index/follow default","Emergency plumbing help in McKinney","1","BreadcrumbList|FAQPage|Organization|WebPage","0","60","4910","","no","","6","12","no"
"/cities/denton","https://plumbinghands.com/cities/denton","200","https://plumbinghands.com/cities/denton","text/html; charset=utf-8","Emergency plumbing help in Denton, TX | Plumbing Hands","Request emergency plumbing and drain cleaning help serving Denton, TX with clear service-area guidance.","https://plumbinghands.com/cities/denton","index/follow default","Emergency plumbing help in Denton","1","BreadcrumbList|FAQPage|Organization|WebPage","0","58","4770","","no","","6","12","no"
"/cities/lewisville","https://plumbinghands.com/cities/lewisville","200","https://plumbinghands.com/cities/lewisville","text/html; charset=utf-8","Emergency plumbing help in Lewisville, TX | Plumbing Hands","Request emergency plumbing and drain cleaning help serving Lewisville, TX with clear service-area guidance.","https://plumbinghands.com/cities/lewisville","index/follow default","Emergency plumbing help in Lewisville","1","BreadcrumbList|FAQPage|Organization|WebPage","0","58","4821","","no","","6","12","no"
"/cities/carrollton","https://plumbinghands.com/cities/carrollton","200","https://plumbinghands.com/cities/carrollton","text/html; charset=utf-8","Emergency plumbing help in Carrollton, TX | Plumbing Hands","Request emergency plumbing and drain cleaning help serving Carrollton, TX with clear service-area guidance.","https://plumbinghands.com/cities/carrollton","index/follow default","Emergency plumbing help in Carrollton","1","BreadcrumbList|FAQPage|Organization|WebPage","0","58","4849","","no","","6","12","no"
"/cities/richardson","https://plumbinghands.com/cities/richardson","200","https://plumbinghands.com/cities/richardson","text/html; charset=utf-8","Emergency plumbing help in Richardson, TX | Plumbing Hands","Request emergency plumbing and drain cleaning help serving Richardson, TX with clear service-area guidance.","https://plumbinghands.com/cities/richardson","index/follow default","Emergency plumbing help in Richardson","1","BreadcrumbList|FAQPage|Organization|WebPage","0","58","4828","","no","","6","12","no"
"/cities/grand-prairie","https://plumbinghands.com/cities/grand-prairie","200","https://plumbinghands.com/cities/grand-prairie","text/html; charset=utf-8","Emergency plumbing help in Grand Prairie, TX | Plumbing Hands","Request emergency plumbing and drain cleaning help serving Grand Prairie, TX with clear service-area guidance.","https://plumbinghands.com/cities/grand-prairie","index/follow default","Emergency plumbing help in Grand Prairie","1","BreadcrumbList|FAQPage|Organization|WebPage","0","58","4865","","no","","6","12","no"
"/cities/mesquite","https://plumbinghands.com/cities/mesquite","200","https://plumbinghands.com/cities/mesquite","text/html; charset=utf-8","Emergency plumbing help in Mesquite, TX | Plumbing Hands","Request emergency plumbing and drain cleaning help serving Mesquite, TX with clear service-area guidance.","https://plumbinghands.com/cities/mesquite","index/follow default","Emergency plumbing help in Mesquite","1","BreadcrumbList|FAQPage|Organization|WebPage","0","58","4778","","no","","6","12","no"
"/cities/grapevine","https://plumbinghands.com/cities/grapevine","200","https://plumbinghands.com/cities/grapevine","text/html; charset=utf-8","Emergency plumbing help in Grapevine, TX | Plumbing Hands","Request emergency plumbing and drain cleaning help serving Grapevine, TX with clear service-area guidance.","https://plumbinghands.com/cities/grapevine","index/follow default","Emergency plumbing help in Grapevine","1","BreadcrumbList|FAQPage|Organization|WebPage","0","58","4795","","no","","6","12","no"
"/cities/euless","https://plumbinghands.com/cities/euless","200","https://plumbinghands.com/cities/euless","text/html; charset=utf-8","Emergency plumbing help in Euless, TX | Plumbing Hands","Request emergency plumbing and drain cleaning help serving Euless, TX with clear service-area guidance.","https://plumbinghands.com/cities/euless","index/follow default","Emergency plumbing help in Euless","1","BreadcrumbList|FAQPage|Organization|WebPage","0","58","4726","","no","","6","12","no"
"/cities/bedford","https://plumbinghands.com/cities/bedford","200","https://plumbinghands.com/cities/bedford","text/html; charset=utf-8","Emergency plumbing help in Bedford, TX | Plumbing Hands","Request emergency plumbing and drain cleaning help serving Bedford, TX with clear service-area guidance.","https://plumbinghands.com/cities/bedford","index/follow default","Emergency plumbing help in Bedford","1","BreadcrumbList|FAQPage|Organization|WebPage","0","58","4739","","no","","6","12","no"
"/cities/hurst","https://plumbinghands.com/cities/hurst","200","https://plumbinghands.com/cities/hurst","text/html; charset=utf-8","Emergency plumbing help in Hurst, TX | Plumbing Hands","Request emergency plumbing and drain cleaning help serving Hurst, TX with clear service-area guidance.","https://plumbinghands.com/cities/hurst","index/follow default","Emergency plumbing help in Hurst","1","BreadcrumbList|FAQPage|Organization|WebPage","0","58","4728","","no","","6","12","no"
"/cities/keller","https://plumbinghands.com/cities/keller","200","https://plumbinghands.com/cities/keller","text/html; charset=utf-8","Emergency plumbing help in Keller, TX | Plumbing Hands","Request emergency plumbing and drain cleaning help serving Keller, TX with clear service-area guidance.","https://plumbinghands.com/cities/keller","index/follow default","Emergency plumbing help in Keller","1","BreadcrumbList|FAQPage|Organization|WebPage","0","58","4754","","no","","6","12","no"
"/cities/southlake","https://plumbinghands.com/cities/southlake","200","https://plumbinghands.com/cities/southlake","text/html; charset=utf-8","Emergency plumbing help in Southlake, TX | Plumbing Hands","Request emergency plumbing and drain cleaning help serving Southlake, TX with clear service-area guidance.","https://plumbinghands.com/cities/southlake","index/follow default","Emergency plumbing help in Southlake","1","BreadcrumbList|FAQPage|Organization|WebPage","0","58","4793","","no","","6","12","no"
"/cities/flower-mound","https://plumbinghands.com/cities/flower-mound","200","https://plumbinghands.com/cities/flower-mound","text/html; charset=utf-8","Emergency plumbing help in Flower Mound, TX | Plumbing Hands","Request emergency plumbing and drain cleaning help serving Flower Mound, TX with clear service-area guidance.","https://plumbinghands.com/cities/flower-mound","index/follow default","Emergency plumbing help in Flower Mound","1","BreadcrumbList|FAQPage|Organization|WebPage","0","58","4827","","no","","6","12","no"
"/cities/the-colony","https://plumbinghands.com/cities/the-colony","200","https://plumbinghands.com/cities/the-colony","text/html; charset=utf-8","Emergency plumbing help in The Colony, TX | Plumbing Hands","Request emergency plumbing and drain cleaning help serving The Colony, TX with clear service-area guidance.","https://plumbinghands.com/cities/the-colony","index/follow default","Emergency plumbing help in The Colony","1","BreadcrumbList|FAQPage|Organization|WebPage","0","58","4817","","no","","6","12","no"
"/cities/allen","https://plumbinghands.com/cities/allen","200","https://plumbinghands.com/cities/allen","text/html; charset=utf-8","Emergency plumbing help in Allen, TX | Plumbing Hands","Request emergency plumbing and drain cleaning help serving Allen, TX with clear service-area guidance.","https://plumbinghands.com/cities/allen","index/follow default","Emergency plumbing help in Allen","1","BreadcrumbList|FAQPage|Organization|WebPage","0","58","4749","","no","","6","12","no"
"/cities/rockwall","https://plumbinghands.com/cities/rockwall","200","https://plumbinghands.com/cities/rockwall","text/html; charset=utf-8","Emergency plumbing help in Rockwall, TX | Plumbing Hands","Request emergency plumbing and drain cleaning help serving Rockwall, TX with clear service-area guidance.","https://plumbinghands.com/cities/rockwall","index/follow default","Emergency plumbing help in Rockwall","1","BreadcrumbList|FAQPage|Organization|WebPage","0","58","4762","","no","","6","12","no"
"/cities/rowlett","https://plumbinghands.com/cities/rowlett","200","https://plumbinghands.com/cities/rowlett","text/html; charset=utf-8","Emergency plumbing help in Rowlett, TX | Plumbing Hands","Request emergency plumbing and drain cleaning help serving Rowlett, TX with clear service-area guidance.","https://plumbinghands.com/cities/rowlett","index/follow default","Emergency plumbing help in Rowlett","1","BreadcrumbList|FAQPage|Organization|WebPage","0","58","4769","","no","","6","12","no"
"/cities/mansfield","https://plumbinghands.com/cities/mansfield","200","https://plumbinghands.com/cities/mansfield","text/html; charset=utf-8","Emergency plumbing help in Mansfield, TX | Plumbing Hands","Request emergency plumbing and drain cleaning help serving Mansfield, TX with clear service-area guidance.","https://plumbinghands.com/cities/mansfield","index/follow default","Emergency plumbing help in Mansfield","1","BreadcrumbList|FAQPage|Organization|WebPage","0","58","4812","","no","","6","12","no"
"/cities/cedar-hill","https://plumbinghands.com/cities/cedar-hill","200","https://plumbinghands.com/cities/cedar-hill","text/html; charset=utf-8","Emergency plumbing help in Cedar Hill, TX | Plumbing Hands","Request emergency plumbing and drain cleaning help serving Cedar Hill, TX with clear service-area guidance.","https://plumbinghands.com/cities/cedar-hill","index/follow default","Emergency plumbing help in Cedar Hill","1","BreadcrumbList|FAQPage|Organization|WebPage","0","58","4810","","no","","6","12","no"
"/cities/desoto","https://plumbinghands.com/cities/desoto","200","https://plumbinghands.com/cities/desoto","text/html; charset=utf-8","Emergency plumbing help in DeSoto, TX | Plumbing Hands","Request emergency plumbing and drain cleaning help serving DeSoto, TX with clear service-area guidance.","https://plumbinghands.com/cities/desoto","index/follow default","Emergency plumbing help in DeSoto","1","BreadcrumbList|FAQPage|Organization|WebPage","0","58","4750","","no","","6","12","no"
"/cities/duncanville","https://plumbinghands.com/cities/duncanville","200","https://plumbinghands.com/cities/duncanville","text/html; charset=utf-8","Emergency plumbing help in Duncanville, TX | Plumbing Hands","Request emergency plumbing and drain cleaning help serving Duncanville, TX with clear service-area guidance.","https://plumbinghands.com/cities/duncanville","index/follow default","Emergency plumbing help in Duncanville","1","BreadcrumbList|FAQPage|Organization|WebPage","0","58","4796","","no","","6","12","no"
"/cities/wylie","https://plumbinghands.com/cities/wylie","200","https://plumbinghands.com/cities/wylie","text/html; charset=utf-8","Emergency plumbing help in Wylie, TX | Plumbing Hands","Request emergency plumbing and drain cleaning help serving Wylie, TX with clear service-area guidance.","https://plumbinghands.com/cities/wylie","index/follow default","Emergency plumbing help in Wylie","1","BreadcrumbList|FAQPage|Organization|WebPage","0","58","4763","","no","","6","12","no"
