"path","url","status","final_url","content_type","title","meta_description","canonical","robots","h1","h1_count","schema_types","schema_errors","internal_links","content_length","old_copy_hits","placeholder_phone","tel_links","label_count","form_control_count","aria_live"
"/cities/dallas/24-hour-emergency-plumber","https://plumbinghands.com/cities/dallas/24-hour-emergency-plumber","200","https://plumbinghands.com/cities/dallas/24-hour-emergency-plumber","text/html; charset=utf-8","24-hour emergency plumber in Dallas, TX | Plumbing Hands","If water is actively leaking, a drain is backing up, or an essential fixture cannot be used safely, shut off the closest valve when possible and request urgent plumbing help. Local service-area guidance for Dallas, TX with provider availability reminders.","https://plumbinghands.com/cities/dallas/24-hour-emergency-plumber","index/follow default","24-hour emergency plumber in Dallas , TX","1","BreadcrumbList|FAQPage|Organization|Service|WebPage","0","44","5191","","no","","6","12","no"
"/cities/dallas/emergency-drain-cleaning","https://plumbinghands.com/cities/dallas/emergency-drain-cleaning","200","https://plumbinghands.com/cities/dallas/emergency-drain-cleaning","text/html; charset=utf-8","emergency drain cleaning in Dallas, TX | Plumbing Hands","Emergency drain cleaning is needed when wastewater is backing up, more than one fixture is affected, or a clog blocks a kitchen, bathroom, or business from operating. Local service-area guidance for Dallas, TX with provider availability reminders.","https://plumbinghands.com/cities/dallas/emergency-drain-cleaning","index/follow default","emergency drain cleaning in Dallas , TX","1","BreadcrumbList|FAQPage|Organization|Service|WebPage","0","44","7007","","no","","6","12","no"
"/cities/fort-worth/24-hour-emergency-plumber","https://plumbinghands.com/cities/fort-worth/24-hour-emergency-plumber","200","https://plumbinghands.com/cities/fort-worth/24-hour-emergency-plumber","text/html; charset=utf-8","24-hour emergency plumber in Fort Worth, TX | Plumbing Hands","If water is actively leaking, a drain is backing up, or an essential fixture cannot be used safely, shut off the closest valve when possible and request urgent plumbing help. Local service-area guidance for Fort Worth, TX with provider availability reminders.","https://plumbinghands.com/cities/fort-worth/24-hour-emergency-plumber","index/follow default","24-hour emergency plumber in Fort Worth , TX","1","BreadcrumbList|FAQPage|Organization|Service|WebPage","0","44","5235","","no","","6","12","no"
"/cities/fort-worth/emergency-drain-cleaning","https://plumbinghands.com/cities/fort-worth/emergency-drain-cleaning","200","https://plumbinghands.com/cities/fort-worth/emergency-drain-cleaning","text/html; charset=utf-8","emergency drain cleaning in Fort Worth, TX | Plumbing Hands","Emergency drain cleaning is needed when wastewater is backing up, more than one fixture is affected, or a clog blocks a kitchen, bathroom, or business from operating. Local service-area guidance for Fort Worth, TX with provider availability reminders.","https://plumbinghands.com/cities/fort-worth/emergency-drain-cleaning","index/follow default","emergency drain cleaning in Fort Worth , TX","1","BreadcrumbList|FAQPage|Organization|Service|WebPage","0","44","5291","","no","","6","12","no"
"/cities/arlington/24-hour-emergency-plumber","https://plumbinghands.com/cities/arlington/24-hour-emergency-plumber","200","https://plumbinghands.com/cities/arlington/24-hour-emergency-plumber","text/html; charset=utf-8","24-hour emergency plumber in Arlington, TX | Plumbing Hands","If water is actively leaking, a drain is backing up, or an essential fixture cannot be used safely, shut off the closest valve when possible and request urgent plumbing help. Local service-area guidance for Arlington, TX with provider availability reminders.","https://plumbinghands.com/cities/arlington/24-hour-emergency-plumber","index/follow default","24-hour emergency plumber in Arlington , TX","1","BreadcrumbList|FAQPage|Organization|Service|WebPage","0","44","5203","","no","","6","12","no"
"/cities/arlington/emergency-drain-cleaning","https://plumbinghands.com/cities/arlington/emergency-drain-cleaning","200","https://plumbinghands.com/cities/arlington/emergency-drain-cleaning","text/html; charset=utf-8","emergency drain cleaning in Arlington, TX | Plumbing Hands","Emergency drain cleaning is needed when wastewater is backing up, more than one fixture is affected, or a clog blocks a kitchen, bathroom, or business from operating. Local service-area guidance for Arlington, TX with provider availability reminders.","https://plumbinghands.com/cities/arlington/emergency-drain-cleaning","index/follow default","emergency drain cleaning in Arlington , TX","1","BreadcrumbList|FAQPage|Organization|Service|WebPage","0","44","5259","","no","","6","12","no"
"/cities/plano/24-hour-emergency-plumber","https://plumbinghands.com/cities/plano/24-hour-emergency-plumber","200","https://plumbinghands.com/cities/plano/24-hour-emergency-plumber","text/html; charset=utf-8","24-hour emergency plumber in Plano, TX | Plumbing Hands","If water is actively leaking, a drain is backing up, or an essential fixture cannot be used safely, shut off the closest valve when possible and request urgent plumbing help. Local service-area guidance for Plano, TX with provider availability reminders.","https://plumbinghands.com/cities/plano/24-hour-emergency-plumber","index/follow default","24-hour emergency plumber in Plano , TX","1","BreadcrumbList|FAQPage|Organization|Service|WebPage","0","44","5151","","no","","6","12","no"
"/cities/plano/emergency-drain-cleaning","https://plumbinghands.com/cities/plano/emergency-drain-cleaning","200","https://plumbinghands.com/cities/plano/emergency-drain-cleaning","text/html; charset=utf-8","emergency drain cleaning in Plano, TX | Plumbing Hands","Emergency drain cleaning is needed when wastewater is backing up, more than one fixture is affected, or a clog blocks a kitchen, bathroom, or business from operating. Local service-area guidance for Plano, TX with provider availability reminders.","https://plumbinghands.com/cities/plano/emergency-drain-cleaning","index/follow default","emergency drain cleaning in Plano , TX","1","BreadcrumbList|FAQPage|Organization|Service|WebPage","0","44","5207","","no","","6","12","no"
"/cities/irving/24-hour-emergency-plumber","https://plumbinghands.com/cities/irving/24-hour-emergency-plumber","200","https://plumbinghands.com/cities/irving/24-hour-emergency-plumber","text/html; charset=utf-8","24-hour emergency plumber in Irving, TX | Plumbing Hands","If water is actively leaking, a drain is backing up, or an essential fixture cannot be used safely, shut off the closest valve when possible and request urgent plumbing help. Local service-area guidance for Irving, TX with provider availability reminders.","https://plumbinghands.com/cities/irving/24-hour-emergency-plumber","index/follow default","24-hour emergency plumber in Irving , TX","1","BreadcrumbList|FAQPage|Organization|Service|WebPage","0","44","5168","","no","","6","12","no"
"/cities/irving/emergency-drain-cleaning","https://plumbinghands.com/cities/irving/emergency-drain-cleaning","200","https://plumbinghands.com/cities/irving/emergency-drain-cleaning","text/html; charset=utf-8","emergency drain cleaning in Irving, TX | Plumbing Hands","Emergency drain cleaning is needed when wastewater is backing up, more than one fixture is affected, or a clog blocks a kitchen, bathroom, or business from operating. Local service-area guidance for Irving, TX with provider availability reminders.","https://plumbinghands.com/cities/irving/emergency-drain-cleaning","index/follow default","emergency drain cleaning in Irving , TX","1","BreadcrumbList|FAQPage|Organization|Service|WebPage","0","44","5224","","no","","6","12","no"
"/cities/garland/24-hour-emergency-plumber","https://plumbinghands.com/cities/garland/24-hour-emergency-plumber","200","https://plumbinghands.com/cities/garland/24-hour-emergency-plumber","text/html; charset=utf-8","24-hour emergency plumber in Garland, TX | Plumbing Hands","If water is actively leaking, a drain is backing up, or an essential fixture cannot be used safely, shut off the closest valve when possible and request urgent plumbing help. Local service-area guidance for Garland, TX with provider availability reminders.","https://plumbinghands.com/cities/garland/24-hour-emergency-plumber","index/follow default","24-hour emergency plumber in Garland , TX","1","BreadcrumbList|FAQPage|Organization|Service|WebPage","0","44","5183","","no","","6","12","no"
"/cities/garland/emergency-drain-cleaning","https://plumbinghands.com/cities/garland/emergency-drain-cleaning","200","https://plumbinghands.com/cities/garland/emergency-drain-cleaning","text/html; charset=utf-8","emergency drain cleaning in Garland, TX | Plumbing Hands","Emergency drain cleaning is needed when wastewater is backing up, more than one fixture is affected, or a clog blocks a kitchen, bathroom, or business from operating. Local service-area guidance for Garland, TX with provider availability reminders.","https://plumbinghands.com/cities/garland/emergency-drain-cleaning","index/follow default","emergency drain cleaning in Garland , TX","1","BreadcrumbList|FAQPage|Organization|Service|WebPage","0","44","5239","","no","","6","12","no"
"/cities/frisco/24-hour-emergency-plumber","https://plumbinghands.com/cities/frisco/24-hour-emergency-plumber","200","https://plumbinghands.com/cities/frisco/24-hour-emergency-plumber","text/html; charset=utf-8","24-hour emergency plumber in Frisco, TX | Plumbing Hands","If water is actively leaking, a drain is backing up, or an essential fixture cannot be used safely, shut off the closest valve when possible and request urgent plumbing help. Local service-area guidance for Frisco, TX with provider availability reminders.","https://plumbinghands.com/cities/frisco/24-hour-emergency-plumber","index/follow default","24-hour emergency plumber in Frisco , TX","1","BreadcrumbList|FAQPage|Organization|Service|WebPage","0","44","5174","","no","","6","12","no"
"/cities/frisco/emergency-drain-cleaning","https://plumbinghands.com/cities/frisco/emergency-drain-cleaning","200","https://plumbinghands.com/cities/frisco/emergency-drain-cleaning","text/html; charset=utf-8","emergency drain cleaning in Frisco, TX | Plumbing Hands","Emergency drain cleaning is needed when wastewater is backing up, more than one fixture is affected, or a clog blocks a kitchen, bathroom, or business from operating. Local service-area guidance for Frisco, TX with provider availability reminders.","https://plumbinghands.com/cities/frisco/emergency-drain-cleaning","index/follow default","emergency drain cleaning in Frisco , TX","1","BreadcrumbList|FAQPage|Organization|Service|WebPage","0","44","5230","","no","","6","12","no"
"/cities/mckinney/24-hour-emergency-plumber","https://plumbinghands.com/cities/mckinney/24-hour-emergency-plumber","200","https://plumbinghands.com/cities/mckinney/24-hour-emergency-plumber","text/html; charset=utf-8","24-hour emergency plumber in McKinney, TX | Plumbing Hands","If water is actively leaking, a drain is backing up, or an essential fixture cannot be used safely, shut off the closest valve when possible and request urgent plumbing help. Local service-area guidance for McKinney, TX with provider availability reminders.","https://plumbinghands.com/cities/mckinney/24-hour-emergency-plumber","index/follow default","24-hour emergency plumber in McKinney , TX","1","BreadcrumbList|FAQPage|Organization|Service|WebPage","0","44","5198","","no","","6","12","no"
"/cities/mckinney/emergency-drain-cleaning","https://plumbinghands.com/cities/mckinney/emergency-drain-cleaning","200","https://plumbinghands.com/cities/mckinney/emergency-drain-cleaning","text/html; charset=utf-8","emergency drain cleaning in McKinney, TX | Plumbing Hands","Emergency drain cleaning is needed when wastewater is backing up, more than one fixture is affected, or a clog blocks a kitchen, bathroom, or business from operating. Local service-area guidance for McKinney, TX with provider availability reminders.","https://plumbinghands.com/cities/mckinney/emergency-drain-cleaning","index/follow default","emergency drain cleaning in McKinney , TX","1","BreadcrumbList|FAQPage|Organization|Service|WebPage","0","44","5254","","no","","6","12","no"
"/problems/water-backing-up-in-shower-and-toilet","https://plumbinghands.com/problems/water-backing-up-in-shower-and-toilet","200","https://plumbinghands.com/problems/water-backing-up-in-shower-and-toilet","text/html; charset=utf-8","Water backing up in shower and toilet | Plumbing Hands","Water backing up in a shower and toilet often means a shared drain or main sewer line is restricted. Stop using water and request sewer or drain help quickly.","https://plumbinghands.com/problems/water-backing-up-in-shower-and-toilet","index/follow default","Water backing up in shower and toilet","1","BreadcrumbList|FAQPage|Organization|WebPage","0","45","6348","","no","","6","12","no"
"/problems/sewer-smell-in-bathroom","https://plumbinghands.com/problems/sewer-smell-in-bathroom","200","https://plumbinghands.com/problems/sewer-smell-in-bathroom","text/html; charset=utf-8","Sewer smell in bathroom | Plumbing Hands","A sewer smell in the bathroom may come from a dry trap, drain buildup, venting issue, or sewer backup risk. If odor appears with slow drains, call for help.","https://plumbinghands.com/problems/sewer-smell-in-bathroom","index/follow default","Sewer smell in bathroom","1","BreadcrumbList|FAQPage|Organization|WebPage","0","45","4666","","no","","6","12","no"
"/problems/toilet-overflowing-will-not-stop","https://plumbinghands.com/problems/toilet-overflowing-will-not-stop","200","https://plumbinghands.com/problems/toilet-overflowing-will-not-stop","text/html; charset=utf-8","Toilet overflowing and will not stop | Plumbing Hands","If a toilet will not stop overflowing, turn the toilet supply valve clockwise, avoid flushing again, and call if the bowl keeps rising or another fixture backs up.","https://plumbinghands.com/problems/toilet-overflowing-will-not-stop","index/follow default","Toilet overflowing and will not stop","1","BreadcrumbList|FAQPage|Organization|WebPage","0","45","4814","","no","","6","12","no"
"/problems/kitchen-sink-backing-up","https://plumbinghands.com/problems/kitchen-sink-backing-up","200","https://plumbinghands.com/problems/kitchen-sink-backing-up","text/html; charset=utf-8","Kitchen sink backing up | Plumbing Hands","A kitchen sink backing up is often caused by grease, food debris, disposal issues, or a deeper branch-line clog. Stop using the sink and disposal.","https://plumbinghands.com/problems/kitchen-sink-backing-up","index/follow default","Kitchen sink backing up","1","BreadcrumbList|FAQPage|Organization|WebPage","0","45","4785","","no","","6","12","no"
"/problems/bathtub-drain-backing-up","https://plumbinghands.com/problems/bathtub-drain-backing-up","200","https://plumbinghands.com/problems/bathtub-drain-backing-up","text/html; charset=utf-8","Bathtub drain backing up | Plumbing Hands","A bathtub drain backing up may be a local tub clog or a sign of a shared bathroom drain issue. Stop running water and watch for toilet gurgling.","https://plumbinghands.com/problems/bathtub-drain-backing-up","index/follow default","Bathtub drain backing up","1","BreadcrumbList|FAQPage|Organization|WebPage","0","45","4694","","no","","6","12","no"
"/problems/floor-drain-backing-up","https://plumbinghands.com/problems/floor-drain-backing-up","200","https://plumbinghands.com/problems/floor-drain-backing-up","text/html; charset=utf-8","Floor drain backing up | Plumbing Hands","A floor drain backing up can point to a main drain or sewer problem, especially when water appears during laundry, showers, or toilet use.","https://plumbinghands.com/problems/floor-drain-backing-up","index/follow default","Floor drain backing up","1","BreadcrumbList|FAQPage|Organization|WebPage","0","45","4629","","no","","6","12","no"
"/problems/gurgling-toilet-and-slow-drains","https://plumbinghands.com/problems/gurgling-toilet-and-slow-drains","200","https://plumbinghands.com/problems/gurgling-toilet-and-slow-drains","text/html; charset=utf-8","Gurgling toilet and slow drains | Plumbing Hands","A gurgling toilet with slow drains can be an early warning of a vent, branch drain, or main sewer restriction. Reduce water use and get guidance.","https://plumbinghands.com/problems/gurgling-toilet-and-slow-drains","index/follow default","Gurgling toilet and slow drains","1","BreadcrumbList|FAQPage|Organization|WebPage","0","45","4618","","no","","6","12","no"
"/problems/main-sewer-line-signs","https://plumbinghands.com/problems/main-sewer-line-signs","200","https://plumbinghands.com/problems/main-sewer-line-signs","text/html; charset=utf-8","Main sewer line signs | Plumbing Hands","Main sewer line signs include multiple slow drains, toilet and tub backup, outdoor cleanout overflow, sewer odor, and gurgling fixtures.","https://plumbinghands.com/problems/main-sewer-line-signs","index/follow default","Main sewer line signs","1","BreadcrumbList|FAQPage|Organization|WebPage","0","45","4619","","no","","6","12","no"
"/problems/burst-pipe-first-steps","https://plumbinghands.com/problems/burst-pipe-first-steps","200","https://plumbinghands.com/problems/burst-pipe-first-steps","text/html; charset=utf-8","Burst pipe first steps | Plumbing Hands","For a burst pipe, shut off the main water valve, stay away from wet electrical areas, open a low faucet to relieve pressure, and request urgent pipe help.","https://plumbinghands.com/problems/burst-pipe-first-steps","index/follow default","Burst pipe first steps","1","BreadcrumbList|FAQPage|Organization|WebPage","0","45","4606","","no","","6","12","no"
"/problems/water-heater-leaking-emergency","https://plumbinghands.com/problems/water-heater-leaking-emergency","200","https://plumbinghands.com/problems/water-heater-leaking-emergency","text/html; charset=utf-8","Water heater leaking emergency | Plumbing Hands","A leaking water heater is urgent when water is spreading, the tank is rusted, or electrical or gas components may be affected. Shut off water and power or gas if safe.","https://plumbinghands.com/problems/water-heater-leaking-emergency","index/follow default","Water heater leaking emergency","1","BreadcrumbList|FAQPage|Organization|WebPage","0","45","4727","","no","","6","12","no"
"/problems/no-hot-water-emergency","https://plumbinghands.com/problems/no-hot-water-emergency","200","https://plumbinghands.com/problems/no-hot-water-emergency","text/html; charset=utf-8","No hot water emergency | Plumbing Hands","No hot water is urgent when it affects health, business operations, or appears with leaking, electrical issues, gas concerns, or a failed water heater.","https://plumbinghands.com/problems/no-hot-water-emergency","index/follow default","No hot water emergency","1","BreadcrumbList|FAQPage|Organization|WebPage","0","45","4668","","no","","6","12","no"
"/problems/ceiling-leak-from-plumbing","https://plumbinghands.com/problems/ceiling-leak-from-plumbing","200","https://plumbinghands.com/problems/ceiling-leak-from-plumbing","text/html; charset=utf-8","Ceiling leak from plumbing | Plumbing Hands","A ceiling leak from plumbing can mean an active pipe, fixture, drain, or water heater issue above. Avoid electrical areas and shut off water if safe.","https://plumbinghands.com/problems/ceiling-leak-from-plumbing","index/follow default","Ceiling leak from plumbing","1","BreadcrumbList|FAQPage|Organization|WebPage","0","45","4631","","no","","6","12","no"
"/problems/outdoor-cleanout-overflowing","https://plumbinghands.com/problems/outdoor-cleanout-overflowing","200","https://plumbinghands.com/problems/outdoor-cleanout-overflowing","text/html; charset=utf-8","Outdoor cleanout overflowing | Plumbing Hands","An outdoor cleanout overflowing often points to a main sewer line blockage. Stop indoor water use and request sewer line help.","https://plumbinghands.com/problems/outdoor-cleanout-overflowing","index/follow default","Outdoor cleanout overflowing","1","BreadcrumbList|FAQPage|Organization|WebPage","0","45","4624","","no","","6","12","no"
"/problems/washing-machine-drain-backing-up","https://plumbinghands.com/problems/washing-machine-drain-backing-up","200","https://plumbinghands.com/problems/washing-machine-drain-backing-up","text/html; charset=utf-8","Washing machine drain backing up | Plumbing Hands","A washing machine drain backing up can be a standpipe, branch drain, or main line problem. Stop the washer and avoid another cycle.","https://plumbinghands.com/problems/washing-machine-drain-backing-up","index/follow default","Washing machine drain backing up","1","BreadcrumbList|FAQPage|Organization|WebPage","0","45","4707","","no","","6","12","no"
"/problems/water-shutoff-valve-will-not-close","https://plumbinghands.com/problems/water-shutoff-valve-will-not-close","200","https://plumbinghands.com/problems/water-shutoff-valve-will-not-close","text/html; charset=utf-8","Water shutoff valve will not close | Plumbing Hands","If a water shutoff valve will not close during a leak, avoid forcing it until it breaks, look for the next upstream shutoff if safe, and request urgent plumbing help.","https://plumbinghands.com/problems/water-shutoff-valve-will-not-close","index/follow default","Water shutoff valve will not close","1","BreadcrumbList|FAQPage|Organization|WebPage","0","45","6325","","no","","6","12","no"
"/cost-guides/emergency-plumbing-cost-dfw","https://plumbinghands.com/cost-guides/emergency-plumbing-cost-dfw","200","https://plumbinghands.com/cost-guides/emergency-plumbing-cost-dfw","text/html; charset=utf-8","Emergency plumber cost in Dallas-Fort Worth | Plumbing Hands","Emergency plumber cost in Dallas-Fort Worth depends on diagnosis, timing, access, parts, severity, and the provider&#x27;s own pricing. Confirm any dispatch or diagnostic fee before work starts.","https://plumbinghands.com/cost-guides/emergency-plumbing-cost-dfw","index/follow default","Emergency plumber cost in Dallas-Fort Worth","1","BreadcrumbList|FAQPage|Organization|WebPage","0","44","6125","","no","","6","12","no"
"/cost-guides/drain-cleaning-cost-dfw","https://plumbinghands.com/cost-guides/drain-cleaning-cost-dfw","200","https://plumbinghands.com/cost-guides/drain-cleaning-cost-dfw","text/html; charset=utf-8","Drain cleaning cost in Dallas-Fort Worth | Plumbing Hands","Drain cleaning cost depends on whether the clog is in one fixture, a shared branch line, or the main sewer line, plus the equipment and access needed.","https://plumbinghands.com/cost-guides/drain-cleaning-cost-dfw","index/follow default","Drain cleaning cost in Dallas-Fort Worth","1","BreadcrumbList|FAQPage|Organization|WebPage","0","44","5890","","no","","6","12","no"
"/cost-guides/sewer-line-clog-cost-guide","https://plumbinghands.com/cost-guides/sewer-line-clog-cost-guide","200","https://plumbinghands.com/cost-guides/sewer-line-clog-cost-guide","text/html; charset=utf-8","Sewer line clog cost guide | Plumbing Hands","Sewer line clog cost varies because clearing the blockage, inspecting the cause, and handling contaminated backup can be separate steps.","https://plumbinghands.com/cost-guides/sewer-line-clog-cost-guide","index/follow default","Sewer line clog cost guide","1","BreadcrumbList|FAQPage|Organization|WebPage","0","44","4416","","no","","6","12","no"
"/cost-guides/water-heater-emergency-cost-guide","https://plumbinghands.com/cost-guides/water-heater-emergency-cost-guide","200","https://plumbinghands.com/cost-guides/water-heater-emergency-cost-guide","text/html; charset=utf-8","Water heater emergency cost guide | Plumbing Hands","Water heater emergency cost depends on whether the issue is a repairable part, a connection leak, a tank failure, or a replacement need.","https://plumbinghands.com/cost-guides/water-heater-emergency-cost-guide","index/follow default","Water heater emergency cost guide","1","BreadcrumbList|FAQPage|Organization|WebPage","0","44","4338","","no","","6","12","no"
"/cost-guides/burst-pipe-emergency-cost-guide","https://plumbinghands.com/cost-guides/burst-pipe-emergency-cost-guide","200","https://plumbinghands.com/cost-guides/burst-pipe-emergency-cost-guide","text/html; charset=utf-8","Burst pipe emergency cost guide | Plumbing Hands","Burst pipe emergency cost depends on pipe location, access, material, whether water is still active, and whether walls, ceilings, or slabs are involved.","https://plumbinghands.com/cost-guides/burst-pipe-emergency-cost-guide","index/follow default","Burst pipe emergency cost guide","1","BreadcrumbList|FAQPage|Organization|WebPage","0","44","4331","","no","","6","12","no"
"/cost-guides/emergency-leak-repair-cost-dfw","https://plumbinghands.com/cost-guides/emergency-leak-repair-cost-dfw","200","https://plumbinghands.com/cost-guides/emergency-leak-repair-cost-dfw","text/html; charset=utf-8","Emergency leak repair cost in Dallas-Fort Worth | Plumbing Hands","Emergency leak repair cost depends on whether water is still active, where the leak is located, what must be opened for access, and whether a shutoff valve also needs repair.","https://plumbinghands.com/cost-guides/emergency-leak-repair-cost-dfw","index/follow default","Emergency leak repair cost in Dallas-Fort Worth","1","BreadcrumbList|FAQPage|Organization|WebPage","0","44","5984","","no","","6","12","no"
