"path","url","status","final_url","content_type","title","meta_description","canonical","robots","h1","h1_count","schema_types","schema_errors","internal_links","content_length","old_copy_hits","placeholder_phone","tel_links","label_count","form_control_count","aria_live"
"/blog/emergency-plumber-near-me-open-now-what-to-do-before-help-arrives","https://plumbinghands.com/blog/emergency-plumber-near-me-open-now-what-to-do-before-help-arrives","200","https://plumbinghands.com/blog/emergency-plumber-near-me-open-now-what-to-do-before-help-arrives","text/html; charset=utf-8","Emergency Plumber Near Me Open Now: What to Do Before Help Arrives | Plumbing Hands","If a plumbing issue cannot wait, shut off water where safe, avoid using affected fixtures, document visible damage, and request an emergency provider connection with your city and problem type.","https://plumbinghands.com/blog/emergency-plumber-near-me-open-now-what-to-do-before-help-arrives","index/follow default","Emergency Plumber Near Me Open Now: What to Do Before Help Arrives","1","Article|BreadcrumbList|FAQPage|Organization|WebPage","0","44","4360","","no","","6","12","no"
"/blog/toilet-overflowing-at-night-in-dallas-fast-steps-for-homeowners","https://plumbinghands.com/blog/toilet-overflowing-at-night-in-dallas-fast-steps-for-homeowners","200","https://plumbinghands.com/blog/toilet-overflowing-at-night-in-dallas-fast-steps-for-homeowners","text/html; charset=utf-8","Toilet Overflowing at Night in Dallas: Fast Steps for Homeowners | Plumbing Hands","For an overnight toilet overflow, close the toilet supply valve, stop flushing, keep people away from contaminated water, and request urgent help if water keeps rising or other fixtures back up.","https://plumbinghands.com/blog/toilet-overflowing-at-night-in-dallas-fast-steps-for-homeowners","index/follow default","Toilet Overflowing at Night in Dallas: Fast Steps for Homeowners","1","Article|BreadcrumbList|FAQPage|Organization|WebPage","0","44","4377","","no","","6","12","no"
"/blog/main-sewer-line-clogged-in-dallas-warning-signs-and-fast-options","https://plumbinghands.com/blog/main-sewer-line-clogged-in-dallas-warning-signs-and-fast-options","200","https://plumbinghands.com/blog/main-sewer-line-clogged-in-dallas-warning-signs-and-fast-options","text/html; charset=utf-8","Main Sewer Line Clogged in Dallas: Warning Signs and Fast Options | Plumbing Hands","A likely main sewer clog shows up as multiple slow drains, toilet-and-tub backup, outdoor cleanout overflow, or sewer odor. Stop water use and request sewer guidance before more wastewater appears.","https://plumbinghands.com/blog/main-sewer-line-clogged-in-dallas-warning-signs-and-fast-options","index/follow default","Main Sewer Line Clogged in Dallas: Warning Signs and Fast Options","1","Article|BreadcrumbList|FAQPage|Organization|WebPage","0","44","4350","","no","","6","12","no"
"/blog/emergency-drain-cleaning-cost-in-dallas-what-affects-the-price","https://plumbinghands.com/blog/emergency-drain-cleaning-cost-in-dallas-what-affects-the-price","200","https://plumbinghands.com/blog/emergency-drain-cleaning-cost-in-dallas-what-affects-the-price","text/html; charset=utf-8","Emergency Drain Cleaning Cost in Dallas: What Affects the Price | Plumbing Hands","Emergency drain cleaning price depends on clog location, access, timing, equipment, and whether a sewer line or camera inspection is needed after the blockage is cleared.","https://plumbinghands.com/blog/emergency-drain-cleaning-cost-in-dallas-what-affects-the-price","index/follow default","Emergency Drain Cleaning Cost in Dallas: What Affects the Price","1","Article|BreadcrumbList|FAQPage|Organization|WebPage","0","44","4283","","no","","6","12","no"
"/blog/roto-rooter-vs-local-emergency-plumber-in-dallas-which-should-you-call","https://plumbinghands.com/blog/roto-rooter-vs-local-emergency-plumber-in-dallas-which-should-you-call","200","https://plumbinghands.com/blog/roto-rooter-vs-local-emergency-plumber-in-dallas-which-should-you-call","text/html; charset=utf-8","Roto-Rooter vs Local Emergency Plumber in Dallas: Which Should You Call | Plumbing Hands","Choose between a national drain brand and a local emergency plumber by comparing response time, scope, fees, equipment, and who will stand behind the diagnosis.","https://plumbinghands.com/blog/roto-rooter-vs-local-emergency-plumber-in-dallas-which-should-you-call","index/follow default","Roto-Rooter vs Local Emergency Plumber in Dallas: Which Should You Call","1","Article|BreadcrumbList|FAQPage|Organization|WebPage","0","44","4293","","no","","6","12","no"
"/blog/sewer-backup-in-fort-worth-what-it-means-and-who-to-call","https://plumbinghands.com/blog/sewer-backup-in-fort-worth-what-it-means-and-who-to-call","200","https://plumbinghands.com/blog/sewer-backup-in-fort-worth-what-it-means-and-who-to-call","text/html; charset=utf-8","Sewer Backup in Fort Worth: What It Means and Who to Call | Plumbing Hands","A sewer backup in Fort Worth can involve contaminated water, main-line blockage, or city-side issues, so stop water use and ask for sewer-specific help quickly.","https://plumbinghands.com/blog/sewer-backup-in-fort-worth-what-it-means-and-who-to-call","index/follow default","Sewer Backup in Fort Worth: What It Means and Who to Call","1","Article|BreadcrumbList|FAQPage|Organization|WebPage","0","44","4217","","no","","6","12","no"
"/blog/bathtub-backing-up-when-toilet-flushes-what-causes-it","https://plumbinghands.com/blog/bathtub-backing-up-when-toilet-flushes-what-causes-it","200","https://plumbinghands.com/blog/bathtub-backing-up-when-toilet-flushes-what-causes-it","text/html; charset=utf-8","Bathtub Backing Up When Toilet Flushes: What Causes It | Plumbing Hands","A tub that backs up when a toilet flushes often points to a shared bathroom drain or main sewer restriction, especially if gurgling or odor appears.","https://plumbinghands.com/blog/bathtub-backing-up-when-toilet-flushes-what-causes-it","index/follow default","Bathtub Backing Up When Toilet Flushes: What Causes It","1","Article|BreadcrumbList|FAQPage|Organization|WebPage","0","44","4207","","no","","6","12","no"
"/blog/kitchen-sink-backing-up-in-dallas-signs-you-need-drain-help","https://plumbinghands.com/blog/kitchen-sink-backing-up-in-dallas-signs-you-need-drain-help","200","https://plumbinghands.com/blog/kitchen-sink-backing-up-in-dallas-signs-you-need-drain-help","text/html; charset=utf-8","Kitchen Sink Backing Up in Dallas: Signs You Need Drain Help | Plumbing Hands","A Dallas kitchen sink backup may come from grease, disposal debris, branch-line buildup, or a deeper clog; stop running water and avoid using the disposal until checked.","https://plumbinghands.com/blog/kitchen-sink-backing-up-in-dallas-signs-you-need-drain-help","index/follow default","Kitchen Sink Backing Up in Dallas: Signs You Need Drain Help","1","Article|BreadcrumbList|FAQPage|Organization|WebPage","0","44","4288","","no","","6","12","no"
"/blog/same-day-drain-cleaning-in-dallas-what-to-expect","https://plumbinghands.com/blog/same-day-drain-cleaning-in-dallas-what-to-expect","200","https://plumbinghands.com/blog/same-day-drain-cleaning-in-dallas-what-to-expect","text/html; charset=utf-8","Same-Day Drain Cleaning in Dallas: What to Expect | Plumbing Hands","Same-day drain cleaning usually starts with fixture history, access checks, clearing attempts, and guidance on whether the issue looks local or main-line related.","https://plumbinghands.com/blog/same-day-drain-cleaning-in-dallas-what-to-expect","index/follow default","Same-Day Drain Cleaning in Dallas: What to Expect","1","Article|BreadcrumbList|FAQPage|Organization|WebPage","0","44","4213","","no","","6","12","no"
"/blog/24-hour-plumber-in-plano-when-the-problem-cannot-wait","https://plumbinghands.com/blog/24-hour-plumber-in-plano-when-the-problem-cannot-wait","200","https://plumbinghands.com/blog/24-hour-plumber-in-plano-when-the-problem-cannot-wait","text/html; charset=utf-8","24-Hour Plumber in Plano: When the Problem Cannot Wait | Plumbing Hands","Call for 24-hour plumbing help in Plano when water is spreading, a toilet will not stop, hot water failure is urgent, or multiple drains back up at once.","https://plumbinghands.com/blog/24-hour-plumber-in-plano-when-the-problem-cannot-wait","index/follow default","24-Hour Plumber in Plano: When the Problem Cannot Wait","1","Article|BreadcrumbList|FAQPage|Organization|WebPage","0","44","4224","","no","","6","12","no"
"/blog/emergency-plumbing-in-arlington-tx-common-night-and-weekend-problems","https://plumbinghands.com/blog/emergency-plumbing-in-arlington-tx-common-night-and-weekend-problems","200","https://plumbinghands.com/blog/emergency-plumbing-in-arlington-tx-common-night-and-weekend-problems","text/html; charset=utf-8","Emergency Plumbing in Arlington TX: Common Night and Weekend Problems | Plumbing Hands","Night and weekend emergency plumbing in Arlington often involves toilet overflows, drain backups, water-heater leaks, burst pipes, and shutoff problems that need fast triage.","https://plumbinghands.com/blog/emergency-plumbing-in-arlington-tx-common-night-and-weekend-problems","index/follow default","Emergency Plumbing in Arlington TX: Common Night and Weekend Problems","1","Article|BreadcrumbList|FAQPage|Organization|WebPage","0","44","4327","","no","","6","12","no"
"/blog/water-heater-leaking-in-dallas-emergency-signs-to-watch","https://plumbinghands.com/blog/water-heater-leaking-in-dallas-emergency-signs-to-watch","200","https://plumbinghands.com/blog/water-heater-leaking-in-dallas-emergency-signs-to-watch","text/html; charset=utf-8","Water Heater Leaking in Dallas: Emergency Signs to Watch | Plumbing Hands","A leaking Dallas water heater is urgent when water spreads, rust or tank failure is visible, or electrical or gas components may be affected.","https://plumbinghands.com/blog/water-heater-leaking-in-dallas-emergency-signs-to-watch","index/follow default","Water Heater Leaking in Dallas: Emergency Signs to Watch","1","Article|BreadcrumbList|FAQPage|Organization|WebPage","0","44","4174","","no","","6","12","no"
"/blog/burst-pipe-in-dallas-what-to-shut-off-first","https://plumbinghands.com/blog/burst-pipe-in-dallas-what-to-shut-off-first","200","https://plumbinghands.com/blog/burst-pipe-in-dallas-what-to-shut-off-first","text/html; charset=utf-8","Burst Pipe in Dallas: What to Shut Off First | Plumbing Hands","During a Dallas burst pipe, shut off the main water valve if safe, avoid wet electrical areas, relieve pressure at a low faucet, and request urgent pipe help.","https://plumbinghands.com/blog/burst-pipe-in-dallas-what-to-shut-off-first","index/follow default","Burst Pipe in Dallas: What to Shut Off First","1","Article|BreadcrumbList|FAQPage|Organization|WebPage","0","44","4191","","no","","6","12","no"
"/blog/drain-smell-in-bathroom-sewer-gas-or-simple-clog","https://plumbinghands.com/blog/drain-smell-in-bathroom-sewer-gas-or-simple-clog","200","https://plumbinghands.com/blog/drain-smell-in-bathroom-sewer-gas-or-simple-clog","text/html; charset=utf-8","Drain Smell in Bathroom: Sewer Gas or Simple Clog | Plumbing Hands","Bathroom drain smell can come from a dry trap, buildup, venting issue, or sewer gas risk; slow drains or backup signs make it more urgent.","https://plumbinghands.com/blog/drain-smell-in-bathroom-sewer-gas-or-simple-clog","index/follow default","Drain Smell in Bathroom: Sewer Gas or Simple Clog","1","Article|BreadcrumbList|FAQPage|Organization|WebPage","0","44","4157","","no","","6","12","no"
"/blog/how-to-know-if-a-clogged-drain-is-actually-a-sewer-line-problem","https://plumbinghands.com/blog/how-to-know-if-a-clogged-drain-is-actually-a-sewer-line-problem","200","https://plumbinghands.com/blog/how-to-know-if-a-clogged-drain-is-actually-a-sewer-line-problem","text/html; charset=utf-8","How to Know if a Clogged Drain Is Actually a Sewer Line Problem | Plumbing Hands","A single slow drain may be local, but multiple fixtures, toilet gurgling, outdoor cleanout overflow, or sewage odor can point to a sewer-line problem.","https://plumbinghands.com/blog/how-to-know-if-a-clogged-drain-is-actually-a-sewer-line-problem","index/follow default","How to Know if a Clogged Drain Is Actually a Sewer Line Problem","1","Article|BreadcrumbList|FAQPage|Organization|WebPage","0","44","4226","","no","","6","12","no"
"/blog/emergency-plumber-vs-regular-plumber-what-is-the-difference","https://plumbinghands.com/blog/emergency-plumber-vs-regular-plumber-what-is-the-difference","200","https://plumbinghands.com/blog/emergency-plumber-vs-regular-plumber-what-is-the-difference","text/html; charset=utf-8","Emergency Plumber vs Regular Plumber: What Is the Difference | Plumbing Hands","Emergency plumbers handle time-sensitive leaks, backups, overflows, and failed essential fixtures, while regular appointments fit planned repairs or non-urgent diagnosis.","https://plumbinghands.com/blog/emergency-plumber-vs-regular-plumber-what-is-the-difference","index/follow default","Emergency Plumber vs Regular Plumber: What Is the Difference","1","Article|BreadcrumbList|FAQPage|Organization|WebPage","0","44","4269","","no","","6","12","no"
"/blog/how-long-should-emergency-drain-cleaning-take","https://plumbinghands.com/blog/how-long-should-emergency-drain-cleaning-take","200","https://plumbinghands.com/blog/how-long-should-emergency-drain-cleaning-take","text/html; charset=utf-8","How Long Should Emergency Drain Cleaning Take | Plumbing Hands","Emergency drain cleaning time varies by access, blockage depth, equipment, fixture count, and whether follow-up camera inspection or sewer work is recommended.","https://plumbinghands.com/blog/how-long-should-emergency-drain-cleaning-take","index/follow default","How Long Should Emergency Drain Cleaning Take","1","Article|BreadcrumbList|FAQPage|Organization|WebPage","0","44","4216","","no","","6","12","no"
"/blog/commercial-drain-backup-what-business-owners-should-do-first","https://plumbinghands.com/blog/commercial-drain-backup-what-business-owners-should-do-first","200","https://plumbinghands.com/blog/commercial-drain-backup-what-business-owners-should-do-first","text/html; charset=utf-8","Commercial Drain Backup: What Business Owners Should Do First | Plumbing Hands","For a commercial drain backup, stop affected fixtures, protect customers and staff from wastewater, document the impacted area, and request provider guidance for business operations.","https://plumbinghands.com/blog/commercial-drain-backup-what-business-owners-should-do-first","index/follow default","Commercial Drain Backup: What Business Owners Should Do First","1","Article|BreadcrumbList|FAQPage|Organization|WebPage","0","44","4306","","no","","6","12","no"
"/blog/dallas-hard-water-and-drain-problems-what-homeowners-should-know","https://plumbinghands.com/blog/dallas-hard-water-and-drain-problems-what-homeowners-should-know","200","https://plumbinghands.com/blog/dallas-hard-water-and-drain-problems-what-homeowners-should-know","text/html; charset=utf-8","Dallas Hard Water and Drain Problems: What Homeowners Should Know | Plumbing Hands","Dallas hard water can contribute to scale, fixture strain, and drain maintenance issues, but sudden backups still need diagnosis for clogs or sewer restrictions.","https://plumbinghands.com/blog/dallas-hard-water-and-drain-problems-what-homeowners-should-know","index/follow default","Dallas Hard Water and Drain Problems: What Homeowners Should Know","1","Article|BreadcrumbList|FAQPage|Organization|WebPage","0","44","4263","","no","","6","12","no"
"/blog/dallas-storms-and-sewer-backups-what-to-check-after-heavy-rain","https://plumbinghands.com/blog/dallas-storms-and-sewer-backups-what-to-check-after-heavy-rain","200","https://plumbinghands.com/blog/dallas-storms-and-sewer-backups-what-to-check-after-heavy-rain","text/html; charset=utf-8","Dallas Storms and Sewer Backups: What to Check After Heavy Rain | Plumbing Hands","After heavy Dallas rain, check floor drains, toilets, outdoor cleanouts, and low fixtures for backup signs before using more water in the home.","https://plumbinghands.com/blog/dallas-storms-and-sewer-backups-what-to-check-after-heavy-rain","index/follow default","Dallas Storms and Sewer Backups: What to Check After Heavy Rain","1","Article|BreadcrumbList|FAQPage|Organization|WebPage","0","44","4224","","no","","6","12","no"
"/blog/emergency-plumbing-cost-guide-for-dallas-homeowners","https://plumbinghands.com/blog/emergency-plumbing-cost-guide-for-dallas-homeowners","200","https://plumbinghands.com/blog/emergency-plumbing-cost-guide-for-dallas-homeowners","text/html; charset=utf-8","Emergency Plumbing Cost Guide for Dallas Homeowners | Plumbing Hands","Emergency plumbing cost depends on diagnosis, timing, access, parts, and whether water damage is active. Ask about dispatch, diagnostic, repair approval, and cleanup scope before work begins.","https://plumbinghands.com/blog/emergency-plumbing-cost-guide-for-dallas-homeowners","index/follow default","Emergency Plumbing Cost Guide for Dallas Homeowners","1","Article|BreadcrumbList|FAQPage|Organization|WebPage","0","44","4309","","no","","6","12","no"
"/blog/drain-cleaning-cost-guide-for-dallas-homeowners","https://plumbinghands.com/blog/drain-cleaning-cost-guide-for-dallas-homeowners","200","https://plumbinghands.com/blog/drain-cleaning-cost-guide-for-dallas-homeowners","text/html; charset=utf-8","Drain Cleaning Cost Guide for Dallas Homeowners | Plumbing Hands","Drain cleaning cost depends on whether the blockage is in one fixture, a shared branch, or the main sewer line. Ask what equipment, access, inspection, and return-policy assumptions are included.","https://plumbinghands.com/blog/drain-cleaning-cost-guide-for-dallas-homeowners","index/follow default","Drain Cleaning Cost Guide for Dallas Homeowners","1","Article|BreadcrumbList|FAQPage|Organization|WebPage","0","44","4321","","no","","6","12","no"
"/blog/best-questions-to-ask-before-you-book-an-emergency-plumber","https://plumbinghands.com/blog/best-questions-to-ask-before-you-book-an-emergency-plumber","200","https://plumbinghands.com/blog/best-questions-to-ask-before-you-book-an-emergency-plumber","text/html; charset=utf-8","Best Questions to Ask Before You Book an Emergency Plumber | Plumbing Hands","Before booking an emergency plumber, ask about dispatch fees, diagnosis, timing, equipment, approval steps, cleanup limits, and whether the provider handles your exact issue.","https://plumbinghands.com/blog/best-questions-to-ask-before-you-book-an-emergency-plumber","index/follow default","Best Questions to Ask Before You Book an Emergency Plumber","1","Article|BreadcrumbList|FAQPage|Organization|WebPage","0","44","5478","","no","","6","12","no"
"/blog/what-counts-as-a-plumbing-emergency","https://plumbinghands.com/blog/what-counts-as-a-plumbing-emergency","200","https://plumbinghands.com/blog/what-counts-as-a-plumbing-emergency","text/html; charset=utf-8","What Counts as a Plumbing Emergency | Plumbing Hands","A plumbing issue counts as an emergency when water damage, sewage exposure, loss of essential use, safety risk, or business interruption cannot reasonably wait.","https://plumbinghands.com/blog/what-counts-as-a-plumbing-emergency","index/follow default","What Counts as a Plumbing Emergency","1","Article|BreadcrumbList|FAQPage|Organization|WebPage","0","44","4166","","no","","6","12","no"
"/blog/signs-your-main-drain-needs-same-day-service","https://plumbinghands.com/blog/signs-your-main-drain-needs-same-day-service","200","https://plumbinghands.com/blog/signs-your-main-drain-needs-same-day-service","text/html; charset=utf-8","Signs Your Main Drain Needs Same-Day Service | Plumbing Hands","Main drain same-day warning signs include several slow fixtures, toilet or shower backup, cleanout overflow, sewer odor, and gurgling after water use.","https://plumbinghands.com/blog/signs-your-main-drain-needs-same-day-service","index/follow default","Signs Your Main Drain Needs Same-Day Service","1","Article|BreadcrumbList|FAQPage|Organization|WebPage","0","44","4181","","no","","6","12","no"
"/blog/toilet-shower-and-sink-backing-up-together-what-it-means","https://plumbinghands.com/blog/toilet-shower-and-sink-backing-up-together-what-it-means","200","https://plumbinghands.com/blog/toilet-shower-and-sink-backing-up-together-what-it-means","text/html; charset=utf-8","Toilet, Shower, and Sink Backing Up Together: What It Means | Plumbing Hands","When a toilet, shower, and sink back up together, the shared branch or main sewer line may be restricted, so reduce water use and seek drain help.","https://plumbinghands.com/blog/toilet-shower-and-sink-backing-up-together-what-it-means","index/follow default","Toilet, Shower, and Sink Backing Up Together: What It Means","1","Article|BreadcrumbList|FAQPage|Organization|WebPage","0","44","4197","","no","","6","12","no"
"/blog/emergency-drain-cleaning-in-fort-worth-fast-homeowner-guide","https://plumbinghands.com/blog/emergency-drain-cleaning-in-fort-worth-fast-homeowner-guide","200","https://plumbinghands.com/blog/emergency-drain-cleaning-in-fort-worth-fast-homeowner-guide","text/html; charset=utf-8","Emergency Drain Cleaning in Fort Worth: Fast Homeowner Guide | Plumbing Hands","Fort Worth emergency drain cleaning begins with identifying affected fixtures, checking for sewer backup indicators, and choosing safe clearing steps for the blockage.","https://plumbinghands.com/blog/emergency-drain-cleaning-in-fort-worth-fast-homeowner-guide","index/follow default","Emergency Drain Cleaning in Fort Worth: Fast Homeowner Guide","1","Article|BreadcrumbList|FAQPage|Organization|WebPage","0","44","4270","","no","","6","12","no"
"/blog/emergency-plumber-in-plano-when-to-call-now","https://plumbinghands.com/blog/emergency-plumber-in-plano-when-to-call-now","200","https://plumbinghands.com/blog/emergency-plumber-in-plano-when-to-call-now","text/html; charset=utf-8","Emergency Plumber in Plano: When to Call Now | Plumbing Hands","Request emergency plumbing in Plano when a leak, backup, overflow, water-heater failure, or shutoff issue could damage property or stop essential use.","https://plumbinghands.com/blog/emergency-plumber-in-plano-when-to-call-now","index/follow default","Emergency Plumber in Plano: When to Call Now","1","Article|BreadcrumbList|FAQPage|Organization|WebPage","0","44","4171","","no","","6","12","no"
"/blog/emergency-drain-cleaning-in-frisco-what-to-expect","https://plumbinghands.com/blog/emergency-drain-cleaning-in-frisco-what-to-expect","200","https://plumbinghands.com/blog/emergency-drain-cleaning-in-frisco-what-to-expect","text/html; charset=utf-8","Emergency Drain Cleaning in Frisco: What to Expect | Plumbing Hands","Emergency drain cleaning in Frisco usually depends on whether the clog affects one fixture, multiple drains, or the main sewer line.","https://plumbinghands.com/blog/emergency-drain-cleaning-in-frisco-what-to-expect","index/follow default","Emergency Drain Cleaning in Frisco: What to Expect","1","Article|BreadcrumbList|FAQPage|Organization|WebPage","0","44","4134","","no","","6","12","no"
"/blog/emergency-sewer-help-in-garland-signs-and-next-steps","https://plumbinghands.com/blog/emergency-sewer-help-in-garland-signs-and-next-steps","200","https://plumbinghands.com/blog/emergency-sewer-help-in-garland-signs-and-next-steps","text/html; charset=utf-8","Emergency Sewer Help in Garland: Signs and Next Steps | Plumbing Hands","Emergency sewer help in Garland is appropriate when wastewater appears, an outdoor cleanout overflows, drains gurgle, or several fixtures slow down together.","https://plumbinghands.com/blog/emergency-sewer-help-in-garland-signs-and-next-steps","index/follow default","Emergency Sewer Help in Garland: Signs and Next Steps","1","Article|BreadcrumbList|FAQPage|Organization|WebPage","0","44","4221","","no","","6","12","no"
"/blog/water-shutoff-valve-will-not-close-during-a-leak","https://plumbinghands.com/blog/water-shutoff-valve-will-not-close-during-a-leak","200","https://plumbinghands.com/blog/water-shutoff-valve-will-not-close-during-a-leak","text/html; charset=utf-8","Water Shutoff Valve Will Not Close During a Leak | Plumbing Hands","If a shutoff valve will not close during a leak, avoid forcing it hard enough to break, look for another upstream valve, and request urgent help.","https://plumbinghands.com/blog/water-shutoff-valve-will-not-close-during-a-leak","index/follow default","Water Shutoff Valve Will Not Close During a Leak","1","Article|BreadcrumbList|FAQPage|Organization|WebPage","0","44","5306","","no","","6","12","no"
"/blog/emergency-leak-approval-checklist-for-homeowners","https://plumbinghands.com/blog/emergency-leak-approval-checklist-for-homeowners","200","https://plumbinghands.com/blog/emergency-leak-approval-checklist-for-homeowners","text/html; charset=utf-8","Emergency Leak Approval Checklist for Homeowners | Plumbing Hands","Before approving emergency leak work, confirm whether water is isolated, what access is needed, what repair scope is included, and what cleanup or restoration work is separate.","https://plumbinghands.com/blog/emergency-leak-approval-checklist-for-homeowners","index/follow default","Emergency Leak Approval Checklist for Homeowners","1","Article|BreadcrumbList|FAQPage|Organization|WebPage","0","44","5291","","no","","6","12","no"
