"area","prior_claim_or_artifact","strict_finding","action_or_status"
"Phase 2 verdict","reports/phase2_verification_and_completion_report.md says PHASE 2 STATUS: COMPLETE WITH OWNER-BLOCKED PRODUCTION CONFIGURATION","Strict rule forbids Phase 2 completion when owner-blocked production routing, analytics/search data, Lighthouse/mobile audit, or deployment identifier remain unverified.","Superseded by this strict report: PHASE 2 NOT COMPLETE."
"Phase 2 closure","reports/phase2_closure_report.md says Phase 2 is closed for Codex-controllable work","Strict command requires all gates to pass, including access-dependent production evidence, before closure.","Superseded; owner-blocked gates remain open."
"Completion matrix","reports/phase2_completion_matrix.csv has multiple COMPLETE rows with owner-only blockers","A COMPLETE row with lead destination, phone, analytics, Search Console, or proof blockers is overstated under the strict rule.","Discrepancy logged; no Phase 3 activation."
"Phase 3 status","reports/PlumbingHands_Phase2_Phase3_Final_Codex_Report_2026-07-14.txt says PHASE 3 STATUS: PARTIALLY COMPLETE","Phase 3 cannot be activated until Phase 2 gates pass and measurement/indexing/backlog/monitoring evidence exists.","Superseded by this strict report: PHASE 3 NOT ACTIVATED."
"Live deployment","Previous final report sampled live site but did not provide a hosting deployment identifier.","Strict command asks for deployment identifier or explicit unverified statement.","Deployment identifier remains NOT VERIFIED; no deployment was performed by this script."
"Public copy","Prior source exposed internal scaffolding phrases on public pages.","Source old-copy scan is clean after remediation.","Homepage, city hub, FAQ, template text, and disclosure wording were refined."
"Production copy","Production must reflect remediated source to pass public quality gate.","Live sampled pages still expose old copy: /; /cities; /faq; /disclosure","Production content remains stale or needs deployment verification."
