"URL","Action","User Urgency","Commercial Relevance","Support For Existing Money Pages","Unique Value","Internal-Link Potential","Conversion Potential","Content Confidence","Duplication Risk","Selected","Rationale"
"/problems/water-shutoff-valve-will-not-close","Create","High","High","High","High","High","High","High","Low","yes","Specific emergency problem that supports burst pipe, ceiling leak, and leak cost content."
"/cost-guides/emergency-leak-repair-cost-dfw","Create","High","High","High","High","High","Medium-high","High","Low","yes","Cost guide fills leak/valve/access/restoration decision gap without exact prices."
"/blog/best-questions-to-ask-before-you-book-an-emergency-plumber","Upgrade","Medium","Medium-high","High","High","High","Medium","High","Low","yes","Existing guide becomes a standalone checklist and future authority-ready asset."
"/cities/dallas","Upgrade","High","High","High","Medium-high","High","High","High","Low","yes","Improves one priority city without mass city-page generation or fake local proof."
"/services/burst-pipe-emergency","Supporting upgrade","High","High","High","Medium-high","High","High","High","Low","supporting","Updated through enhancement links and leak/shutoff guidance to support selected targets."
"/cost-guides/water-heater-emergency-cost-guide","Defer","Medium","Medium","Medium","Medium","Medium","Medium","Medium","Low","no","Useful future repair-versus-replacement upgrade, but leak cluster had stronger immediate opportunity."
