"category","specific_target","type","benefit","status","owner_requirement"
"local chamber/resource directory","OWNER VERIFICATION REQUIRED","citation","local trust and durable brand visibility","prepared only","owner must verify target and no fake address"
"home-service directory with service-area option","OWNER VERIFICATION REQUIRED","citation","qualified referral traffic","prepared only","owner must verify no paid ranking link"
"Texas trade association directory","OWNER VERIFICATION REQUIRED","citation","industry relevance","prepared only","owner must verify eligibility"
"property manager vendor resource","OWNER VERIFICATION REQUIRED","partner","partnership value and lead potential","prepared only","owner must verify relationship"
"restoration partner resource","OWNER VERIFICATION REQUIRED","partner","referral relevance","prepared only","owner must verify relationship"
"supplier contractor resource","OWNER VERIFICATION REQUIRED","partner","industry relevance","prepared only","owner must verify relationship"
"homeowner preparedness article","OWNER VERIFICATION REQUIRED","editorial","editorial authority","prepared only","owner must approve pitch"
"local newsletter resource roundup","OWNER VERIFICATION REQUIRED","editorial","local trust","prepared only","owner must approve pitch"
